{
  "$schema": "https://tuna-os.github.io/wootc/schemas/v1/plugin.schema.json",
  "schemaVersion": 1,
  "id": "files",
  "name": "Your files",
  "version": "1.0.0",
  "description": "Discovers personal folders (Documents, Pictures, Downloads, Music, Videos, Desktop).",
  "category": "files",
  "author": "TunaOS Contributors",
  "license": "Apache-2.0",
  "homepage": "https://github.com/tuna-os/wootc",
  "target": {
    "appType": "native",
    "suggestedPackages": [],
    "requiresHostMount": true
  },
  "execution": {
    "detectTimeoutSec": 10,
    "importTimeoutSec": 60,
    "requiresAdmin": false
  },
  "ui": {
    "defaultOn": true
  }
}
