{
  "$schema": "https://tuna-os.github.io/wootc/schemas/v1/plugin.schema.json",
  "schemaVersion": 1,
  "id": "office",
  "name": "Office Documents & Templates",
  "version": "1.0.0",
  "description": "Migrates MS Office custom dictionaries, templates, fonts, and sets LibreOffice defaults.",
  "category": "office",
  "author": "TunaOS Contributors",
  "license": "Apache-2.0",
  "homepage": "https://github.com/tuna-os/wootc",
  "target": {
    "appType": "native",
    "suggestedPackages": [
      "org.libreoffice.LibreOffice"
    ],
    "requiresHostMount": true
  },
  "execution": {
    "detectTimeoutSec": 10,
    "importTimeoutSec": 60,
    "requiresAdmin": false
  },
  "ui": {
    "defaultOn": true
  }
}
